Molecule ID	Compound Name	SMILES	PubChem ID	Class	Subclass	Species	References	PMIDs	Links	Bioactivities
Mol_03267	Abietic acid	CC(C1=CC2=CC[C@@H]3[C@]([C@H]2CC1)(C)CCC[C@@]3(C)C(=O)O)C	10569	Terpenoid	Abietane diterpene	Cedrus atlantica; Juniperus species; Croton megalocarpoides	Abietane diterpenes from the cones of Cedrus atlantica; Oxygenated diterpenes and other constituents from Moroccan Juniperus phoenicea and Juniperus thurifera var. africana; New ent-Clerodane and Abietane Diterpenoids from the Roots of Kenyan Croton megalocarpoides Friis and M. G. Gilbert.	15649517; 15381415; 27286332	10.1016/j.phytochem.2004.10.017; 10.1016/j.phytochem.2004.07.021; https://www.thieme-connect.com/products/ejournals/html/10.1055/s-0042-108857	
Mol_08337	Abyssinin i	COc1cc(cc2c1OC(C)(C)C=C2)C1CC(=O)c2c(O1)cc(cc2O)O	44424650	Flavonoid	Flavanone	Erythrina abyssinica; Erythrina abyssinica	Isoprenylated flavonoids from the stem bark of Erythrina abyssinica.; Structural Elucidation of New Flavanones Isolated from Erythrina abyssinica.	17489632; 17489632	10.1021/np060477%2B; 10.1021/np960440x	
Mol_08332	Abyssinin ii	COc1cc(cc(c1O)CC=C(C)C)[C@@H]1CC(=O)c2c(O1)cc(cc2O)O	442457	Flavonoid	Flavanone	Erythrina abyssinica; Erythrina abyssinica	Isoprenylated flavonoids from the stem bark of Erythrina abyssinica.; Structural Elucidation of New Flavanones Isolated from Erythrina abyssinica.	17489632; 17489632	10.1021/np060477%2B; 10.1021/np960440x	
Mol_08316	Abyssinin iii	CC(=CCc1c(cc(c(c1CC=C(C)C)O)O)[C@@H]1CC(=O)c2c(O1)cc(cc2O)O)C	15293189	Flavonoid	Chalcone	Erythrina abyssinica; Erythrina abyssinica; Erythrina abyssinica	Anti-plasmodial flavonoids from the stem bark of Erythrina abyssinica.; Structural Elucidation of New Flavanones Isolated from Erythrina abyssinica.; 8-Methoxyneorautenol and radical scavenging flavonoids from Erythrina abyssinica.	15504437; 17489632; 17489632	10.1016/j.phytochem.2004.08.050; 10.1021/np960440x; https://www.ajol.info/index.php/bcse/article/viewFile/44963/28454	anti-plasmodial; radical scavenging towards 2;2-diphenyl-1-picrylhydrazyl radical (dpph)
Mol_08317	Abyssinone iv	CC(=CCc1cc(cc(c1O)CC=C(C)C)C1CC(=O)c2c(O1)cc(cc2)O)C	4063835	Flavonoid	Flavanone	Erythrina abyssinica; Erythrina abyssinica; Erythrina abyssinica; Erythrina abyssinica	Anti-plasmodial flavonoids from the stem bark of Erythrina abyssinica.; 8-Methoxyneorautenol and radical scavenging flavonoids from Erythrina abyssinica.; Flavonoids and isoflavonoids with antiplasmodial activities from the root bark of Erythrina abyssinica.; Ethnobotanical drug discovery based on medicine men's trials in the African savanna: screening of east African plants for antimicrobial activity II.	15504437; 17489632; 12898424; 8254349	10.1016/j.phytochem.2004.08.050; https://www.ajol.info/index.php/bcse/article/viewFile/44963/28454; https://www.thieme-connect.com/products/ejournals/html/10.1055/s-2003-41119; 10.1021/np50099a012	anti-plasmodial; radical scavenging towards 2;2-diphenyl-1-picrylhydrazyl radical (dpph); antimicrobial
Mol_08013	Acetyl aleurotolic acid	CC(=O)O[C@H]1CC[C@]2([C@H](C1(C)C)CC[C@@]1([C@@H]2CC[C@@]2(C1=CC[C@@]1([C@H]2CC(C)(C)CC1)C(=O)O)C)C)C	161616	Terpenoid	Triterpenoid	Croton megalocarpoides; Croton alienus; Neoboutonia macrocalyx; Erigeron floribundus; Croton oligandrus; Croton oligandrus; Discoglypremna caloneura; Neoboutonia macrocalyx; Alchornea cordifolia; Croton macrostachys	New ent-Clerodane and Abietane Diterpenoids from the Roots of Kenyan Croton megalocarpoides Friis and M. G. Gilbert.; Alienusolin, a new 4α-deoxyphorbol ester derivative, and crotonimide C, a new glutarimide alkaloid from the Kenyan Croton alienus.; Antiplasmodial compounds from the stem bark of Neoboutonia macrocalyx pax.; Phenolic constituents of Erigeron floribundus (Asteraceae), a Cameroonian medicinal plant.; Ent-Clerodane Diterpenes from the Bark of Croton oligandrus Pierre ex Hutch. and Assessment of Their Cytotoxicity against Human Cancer Cell Lines; Crotoliganfuran, a new clerodane-type furano-diterpenoid from <i>Croton oligandrus</i> Pierre ex Hutch.; A new isoquinoline and ceramide from the stem barks of Discoglypremna caloneura (Pax) Prain (Euphorbiaceae) with antiproteinase and cytotoxic activities.; Terpenoids from the stem bark of Neoboutonia macrocalyx (Euphorbiaceae); Anti-HIV-1 integrase potency of methylgallate from Alchornea cordifolia using in vitro and in silico approaches.; Diterpenoids from the roots of Croton macrostachys	27286332; 24356872; 25535086; 25632460; 29438356; 31148485; 33624570; 30886338	https://www.thieme-connect.com/products/ejournals/html/10.1055/s-0042-108857; https://www.thieme-connect.com/products/ejournals/html/10.1055/s-0033-1351044; 10.1016/j.jep.2014.12.018; 10.1177/1934578X1400901207; 10.3390/molecules23020410; 10.1080/14786419.2019.1613399; 10.1080/14786419.2021.1890073; 10.1016/j.phytol.2015.04.026; 10.1038/s41598-019-41403-x; 10.1016/s0031-9422(00)00166-7	anti-plasmodial; cytotoxicity; cytotoxic
Mol_09557	Acetylmaesaquinone	CCCC/C=C/CCCCCCCCCCCCCC1=C(OC(=O)C)C(=O)C(=C(C1=O)OC(=O)C)C	6387258	Quinone	Benzoquinone	Maesa lanceolata	Distribution of benzoquinone pigments in Kenyan Myrsinaceae.	15186932	https://www.ajol.info/index.php/bcse/article/viewFile/79494/69783	
Mol_09843	Acetylmaesaquinone	CCCC/C=C/CCCCCCCCCCCCCC1=C(O)C(=O)C(=C(C1=O)OC(=O)C)C	44631006	Quinone	Benzoquinone	Maesa lanceolata	Benzoqidnone pigments in kenyan myrsinaceae: new 2, 5-dlhydroxyalkyl derivatives from Maesa lanceolata.	5648113	https://www.ajol.info/index.php/bcse/article/download/79189/69500	
Mol_09477	Aegicerin	O[C@H]1CC[C@]2([C@H](C1(C)C)CC[C@@]1([C@@H]2CC[C@]23[C@@]1(C)CC(=O)[C@@]1([C@H]3CC(C)(C)CC1)CO2)C)C	15558423	Terpenoid	Triterpenoid	Embelia schimperi; Embelia schimperi	Pentacyclic triterpenoids from Embelia schimperi.; Oleanane-type triterpenes of Embelia schimperi leaves.	12560028; 16973190	10.1016/S0031-9422(02)00619-2; 10.1016/j.phytochem.2006.07.025	antibacterial
Mol_08555	Afrormosin	COc1ccc(cc1)c1coc2c(c1=O)cc(c(c2)O)OC	5281704	Flavonoid	Isoflavone	Millettia leucantha; Taverniera abyssinica; Angylocalyx oligophyllus; Millettia macrophylla	4'-Prenyloxyderrone from the stem bark of Millettia oblata ssp. teitensis and the antiplasmodial activities of isoflavones from some Millettia species.; Isoflavonoids from Taverniera abyssinica.; Phytochemical analysis of the stems of Angylocalyx oligophyllus (Baker) Baker f. (Fabaceae); Estrogenic and cytotoxic potentials of compounds isolated from Millettia macrophylla Benth (Fabaceae): towards a better understanding of its underlying mechanisms.	14561074; 19173126; 27784319	10.1016/j.phytol.2014.02.001; https://www.ajol.info/index.php/bcse/article/viewFile/79574/69854; 10.1016/j.bse.2022.104382; 10.1186/s12906-016-1385-5	anti-plasmodial
Mol_08062	Ajugarin-1	CC(=O)OC[C@@]12[C@@H](OC(=O)C)C[C@H]([C@]([C@H]1CCC[C@@]12CO1)(C)CCC1=CC(=O)OC1)C	173866	Terpenoid	Diterpenoid	Ajuga remota	The antiplasmodial activity of isolates from Ajuga remota.	12027771	10.1021/np0104626	anti-plasmodial
Mol_08014	Alienusolin	CCCCCCCCCC(=O)OCC1=C[C@H]2[C@H]3[C@@](C3(C)C)(OC(=O)C)[C@@H]([C@H]([C@@]2([C@H]2[C@@H](C1)C(=O)C(=C2)C)O)C)OC(=O)CCCCCCCCC	163004368	Ester	4alpha-deoxyphorbol ester	Croton alienus	Alienusolin, a new 4α-deoxyphorbol ester derivative, and crotonimide C, a new glutarimide alkaloid from the Kenyan Croton alienus.	24356872	https://www.thieme-connect.com/products/ejournals/html/10.1055/s-0033-1351044	
Mol_09666	Alloocimene	C/C=C(/C=C/C=C(C)C)\C	5368821	Terpenoid; Terpenoid	Monoterpene; Sesquiterpene	Tagetes minuta; Thymus broussonetii; Teucrium scorodonia L. subsp. baeticum	Chemical composition and Antibacterial activity of essential oils of Tagetes minuta (Asteraceae) against selected plant pathogenic bacteria.; Antibacterial activity of Thymus maroccanus and Thymus broussonetii essential oils against nosocomial infection – bacteria and their synergistic potential with antibiotics; Chemical and genetic differentiation of two Mediterranean subspecies of Teucrium scorodonia L.	27721831; 22257599; 22119065	https://www.ncbi.nlm.nih.gov/pmc/articles/PMC5046036/pdf/IJMICRO2016-7352509.pdf; 10.1016/j.phymed.2011.12.003; 10.1016/j.phytochem.2011.09.002	antibacterial
Mol_07194	Aloechrysone	COc1cccc2c1c(O)c1c(c2)C[C@@](CC1=O)(C)O	101712954	Quinone	Pre-anthraquinone	Aloe berhana; Aloe rivae; Aloe megalacantha; Aloe behana; Aloe berhana; Aloe graminicola; Aloe species	Constituents of the leaves of four Aloe species from Ethiopia; Constituents of the leaves of four Aloe species from Ethiopia; Constituents of the leaves of four Aloe species from Ethiopia; Review of the chemistry of Aloes of Africa; Aloechrysone, a dihydroanthracenone from Aloe berhana.; (R)-Prechrysophanol from Aloe graminicola.; Anthraquinones, pre-anthraquinones and isoeleutherol in the roots of Aloe species.	18067107; 18067107; 18067107; 18067107; 15186932; 1368857; 1368857	https://www.ajol.info/index.php/bcse/article/view/79147; https://www.ajol.info/index.php/bcse/article/view/79147; https://www.ajol.info/index.php/bcse/article/view/79147; https://www.ajol.info/index.php/bcse/article/view/73954; 10.1016/0031-9422(92)83149-S; 10.1016/0031-9422(91)80049-7; 10.1016/S0031-9422(00)94771-X	
Mol_07102	Aloesaponarin i	COC(=O)c1c(O)cc2c(c1C)C(=O)c1c(C2=O)cccc1O	11098986	Quinone	Anthraquinone	Aloe dawei; Aloe secundiflora; Aloe saponaria; Aloe pulcherrima; Aloe berhana; Aloe graminicola; Aloe species	Cytotoxic quinones from the roots of Aloe dawei; Naphthoquinones from the roots of Aloe secundiflora; Review of the chemistry of Aloes of Africa; Phytochemical investigation of Aloe pulcherrima roots and evaluation for its antibacterial and antiplasmodial activities.; Aloechrysone, a dihydroanthracenone from Aloe berhana.; (R)-Prechrysophanol from Aloe graminicola.; Anthraquinones, pre-anthraquinones and isoeleutherol in the roots of Aloe species.	24642911; 24273862; 18067107; 28333961; 15186932; 1368857; 1368857	http://www.mdpi.com/1420-3049/19/3/3264; 10.1016/j.phytol.2012.04.014; https://www.ajol.info/index.php/bcse/article/view/73954; https://www.ncbi.nlm.nih.gov/pmc/articles/PMC5363824/pdf/pone.0173882.pdf; 10.1016/0031-9422(92)83149-S; 10.1016/0031-9422(91)80049-7; 10.1016/S0031-9422(00)94771-X	cytotoxic; antibacterial; anti-plasmodial
Mol_07103	Aloesaponarin ii	Oc1cc(C)c2c(c1)C(=O)c1c(C2=O)c(O)ccc1	3085033	Quinone	Anthraquinone	Aloe dawei; Aloe secundiflora; Aloe saponaria; Aloe pulcherrima; Aloe graminicola; Aloe species	Cytotoxic quinones from the roots of Aloe dawei; Naphthoquinones from the roots of Aloe secundiflora; Review of the chemistry of Aloes of Africa; Phytochemical investigation of Aloe pulcherrima roots and evaluation for its antibacterial and antiplasmodial activities.; (R)-Prechrysophanol from Aloe graminicola.; Anthraquinones, pre-anthraquinones and isoeleutherol in the roots of Aloe species.	24642911; 24273862; 18067107; 28333961; 1368857; 1368857	http://www.mdpi.com/1420-3049/19/3/3264; 10.1016/j.phytol.2012.04.014; https://www.ajol.info/index.php/bcse/article/view/73954; https://www.ncbi.nlm.nih.gov/pmc/articles/PMC5363824/pdf/pone.0173882.pdf; 10.1016/0031-9422(91)80049-7; 10.1016/S0031-9422(00)94771-X	cytotoxic; antibacterial; anti-plasmodial
Mol_07107	Aloesaponol i	COC(=O)c1c(O)cc2c(c1C)c(O)c1c(c2)CC(CC1=O)O	44631015	Quinone	Anthraquinone	Aloe dawei; Aloe secundiflora; Aloe saponaria; Aloe berhana; Aloe graminicola; Aloe species	Cytotoxic quinones from the roots of Aloe dawei; Naphthoquinones from the roots of Aloe secundiflora; Review of the chemistry of Aloes of Africa; Aloechrysone, a dihydroanthracenone from Aloe berhana.; (R)-Prechrysophanol from Aloe graminicola.; Anthraquinones, pre-anthraquinones and isoeleutherol in the roots of Aloe species.	24642911; 24273862; 18067107; 15186932; 1368857; 1368857	http://www.mdpi.com/1420-3049/19/3/3264; 10.1016/j.phytol.2012.04.014; https://www.ajol.info/index.php/bcse/article/view/73954; 10.1016/0031-9422(92)83149-S; 10.1016/0031-9422(91)80049-7; 10.1016/S0031-9422(00)94771-X	cytotoxic
Mol_07150	Aloesaponol ii	OC1CC(=O)c2c(C1)cc1c(c2O)c(C)cc(c1)O	102239772	Quinone	Anthraquinone	Aloe secundiflora; Aloe saponaria; Aloe graminicola; Aloe species	Naphthoquinones from the roots of Aloe secundiflora; Review of the chemistry of Aloes of Africa; (R)-Prechrysophanol from Aloe graminicola.; Anthraquinones, pre-anthraquinones and isoeleutherol in the roots of Aloe species.	24273862; 18067107; 1368857; 1368857	10.1016/j.phytol.2012.04.014; https://www.ajol.info/index.php/bcse/article/view/73954; 10.1016/0031-9422(91)80049-7; 10.1016/S0031-9422(00)94771-X	
Mol_07108	Aloesaponol ii-6-methyl ether	COc1cc2cc3CC(O)CC(=O)c3c(c2c(c1)C)O	162854695	Quinone		Aloe dawei	Cytotoxic quinones from the roots of Aloe dawei	24642911	http://www.mdpi.com/1420-3049/19/3/3264	cytotoxic
Mol_07216	Aloesin	OC[C@H]1O[C@H]([C@@H]([C@H]([C@@H]1O)O)O)c1c(O)cc(c2c1oc(CC(=O)C)cc2=O)C	160190	Quinone	Anthrone	Aloe turkanensis; Aloe scabrifolia; Aloe species	Chemotaxonomy of Aloe turkanensis and Aloe scabrifolia from Kenya; Chemotaxonomy of Aloe turkanensis and Aloe scabrifolia from Kenya; Review of the chemistry of Aloes of Africa	18067107; 18067107; 18067107	10.1016/0305-1978(96)00012-9; 10.1016/0305-1978(96)00012-9; https://www.ajol.info/index.php/bcse/article/view/73954	
Mol_08193	Alpha,4,2'-trihydroxy-4'-o-geranyldihydrochalcone	C/C(=C\COc1ccc(c(c1)O)C(=O)C(Cc1ccc(cc1)O)O)/CC=C(C)C	42607723	Chalcone		Millettia usaramensis usaramensis	Rotenoids, isoflavones and chalcones from the stem bark of Millettia usaramensis subspecies usaramensis	13679101	http://ac.els-cdn.com/S003194229700424X/1-s2.0-S003194229700424X-main.pdf?_tid=872b02f4-13af-11e7-9d48-00000aab0f27&acdnat=1490703206_ef706f4117f7835273c5765a438836b5	
Mol_00445	Alpha-amyrin	C[C@@H]1CC[C@]2([C@@H]([C@H]1C)C1=CC[C@H]3[C@@]([C@@]1(CC2)C)(C)CC[C@@H]1[C@]3(C)CC[C@@H](C1(C)C)O)C	73170	Terpenoid	Triterpenoid	Pergularia tomentosa; Periploca laevigata; Solenostemma argel; Bombax malabaricum; Cleome paradoxa; Torilis radiata; Centaurea africana; Echinops galalensis; Gaillardia aristata; Inula crithmoides; Boswellia neglecta; Commiphora confusa; Boswellia species; Vernonia auriculifera; Vernonia auriculifera; Artocarpus communis; Sarcocephalus pobeguinii	Two new taraxasterol-type triterpenes from Pergularia tomentosa growing wild in Algeria; Medicinal plants of Tunisia. the structure of periplocadiol, a new elemane-type sesquiterpene isolated from the roots of Periploca laevigata; Pregnene derivatives from Solenostemma argel leaves; Phytochemical investigation and biological studies of Bombax malabaricum flowers; Biological and Chemical Study of Cleome paradoxa B.Br.; Hepatoprotective constituents of Torilis radiata Moench (Apiaceae); A flavonoid with cytotoxic activity and other constituents from Centaurea africana; Protective effect of Echinops galalensis against CCl4-induced injury on the human hepatoma cell line (Huh7); Cytotoxic compounds from the leaves of Gaillardia aristata Pursh. growing in Egypt; A carotane derivative and a eudesmanolide from Inula crithmoides; Triterpenes from the resin of Boswellia neglecta; Dammarane triterpenes from the resins of Commiphora confusa; Phytochemical investigation of the resins of Boswellia species collected from Kebtele area in Agew-Awi (Gojjam); Triterpenoids from Vernonia auriculifera Hiern exhibit antimicrobial activity; The phytochemistry and biological activity of secondary metabolites from Kenyan Vernonia and Vepris species; Antimicrobial activities of the methanol extract and compounds from Artocarpus communis (Moraceae).; In vitro antiproliferative, anti-inflammatory effects and molecular docking studies of natural compounds isolated from Sarcocephalus pobeguinii (Hua ex Pobég).	23106554; 11394848; 21246441; 21867456; 21846263; 11830156; 12736444; 12736444; 26208861; 26208861; 21612612; 37416061	10.1080/10286020.2012.733700; 10.1021/np50064a021; http://www.sciencedirect.com/science/article/pii/S0031942201001212; 10.1080/14786419.2010.518146; http://www.phcogres.com/text.asp?2009/1/4/175/58087; 10.1080/14786419.2011.587422; 10.1016/j.phytol.2009.03.002; 10.1016/j.phytol.2012.10.012; 10.1080/14786419.2011.606219; 10.1016/0031-9422(81)85164-3; http://www.ajol.info/index.php/bcse/article/view/20952; http://www.ajol.info/index.php/bcse/article/view/20951; http://etd.aau.edu.et/handle/123456789/672; http://www.academicjournals.org/journal/AJPP/article-abstract/E1CC7A033259; http://r.search.yahoo.com/_ylt=A0LEVw56_NVYklIA6wdXNyoA;_ylu=X3oDMTBybGY3bmpvBGNvbG8DYmYxBHBvcwMyBHZ0aWQDBHNlYwNzcg--/RV=2/RE=1490447610/RO=10/RU=http%3a%2f%2fresearchspace.ukzn.ac.za%2fbitstream%2fhandle%2f10413%2f9707%2fKiplimo_Joyce_Jepkorir_2012.pdf%3bsequence%3d1/RK=0/RS=vUjfDhOQDY57aKNmCQGBZiZ2ecg-; 10.1186/1472-6882-11-42; 10.3389/fphar.2023.1205414	protective against ccl4-induced injury on the human hepatoma cell line (huh7); cytotoxic; antibacterial
Mol_12314	Alpha-amyrinone acetate	CC(=O)O[C@H]1CC[C@]2([C@H](C1(C)C)CC[C@@]1([C@@H]2CC=C2[C@@]1(C)CC[C@@]1([C@H]2[C@@H](C)[C@H](C)CC1)C)C)C	92842	Terpenoid	Triterpenoid	Morus mesozygia; Omphalocarpum elatum; Ocimum kilimandscharicum	Prenylated arylbenzofuran derivatives from Morus mesozygia with antioxidant activity.; Elatumic acid: a new ursolic acid congener from Omphalocarpum elatum Miers (Sapotaceae).; Chemical constituents of Ocimum kilimandscharicum Guerke acclimatized in Kakamega forest, Kenya	19147162; 25265847	10.1016/j.phytochem.2008.12.014; 10.5560/ZNC.2014-0050; 10.4314/bcse.v33i3.13	
Mol_07957	Alpha-fenchyl alcohol	OC1C2(C)CCC(C1(C)C)C2	15406	Terpenoid	Sesquiterpene	Tarchonanthus camphoratus	Repellency of essential oils of some Kenyan plants against Anopheles gambiae	15474566	10.1016/j.phytochem.2004.08.035	
Mol_08116	Alpha-fenchyl alcohol	O[C@@H]1[C@]2(C)CC[C@H](C1(C)C)C2	6997371	Essential oil		Tetradenia riparia	Repellency of essential oils of some Kenyan plants against Anopheles gambiae	15474566	10.1016/j.phytochem.2004.08.035	
Mol_00298	Alpha-humulene	C/C/1=C\CC(C)(C)/C=C/C/C(=C/CC1)/C	5281520	Terpenoid; Terpenoid	Monoterpene; Sesquiterpene	Pistacia lentiscus; Cupressus dupreziana; Cupressus sempervirens; Cupressus arizonica; Chrysanthemum viscidehirtum; Commiphora quadricincta; Ocimum kenyense; Tagetes minuta; Cyperus rotundus; Cymbopogon schoenanthus; Cyperus rotundus; Juglans regia; Thymus maroccanus; Teucrium scorodonia L. subsp. baeticum; Teucrium polium subsp. polium; Mentha pulegium	Chemical composition of the essential oil of Pistacia lentiscus L. from Eastern Morocco; Volatile constituents of the leaves of Cupressus duprezzana and Cupressus semper virens; Volatile constituents of the leaves of Cupressus duprezzana and Cupressus semper virens; Chemical composition and antimicrobial activity of essential oils of Cupressus arizonica Greene; Antibacterial and molluscicidal activities of the essential oil of Chrysanthemum viscidehirtum; Seasonal variation in the essential oil composition of Commiphora quadricincta and its effect on the maturation of immature adults of the desert locust, Schistocerca gregaria; Blend effects in the toxicity of the essential oil constituents of Ocimum kilimandscharicum and Ocimum kenyense (Labiateae) on two post-harvest insect pests.; Chemical composition and Antibacterial activity of essential oils of Tagetes minuta (Asteraceae) against selected plant pathogenic bacteria.; Antimalarial compounds containing an alpha,beta-unsaturated carbonyl moiety from Tanzanian medicinal plants.; Chemical composition, antiproliferative, antioxidant and antibacterial activities of essential oils from aromatic plants growing in Sudan; Chemical composition, antiproliferative, antioxidant and antibacterial activities of essential oils from aromatic plants growing in Sudan; Phytochemical Investigation by Microwave-Assisted Extraction of Essential Oil of the Leaves of Walnut Cultivated in Algeria; Antimicrobial and insecticidal activities of the Endemic Thymus broussonetti Boiss. and Thymus maroccanus Ball.; Chemical and genetic differentiation of two Mediterranean subspecies of Teucrium scorodonia L.; Chemical and genetic diversity of two Mediterranean subspecies of Teucrium polium L.; Influence of in vitro growth conditions in the production of defence compounds in Mentha pulegium L.	11449503; 11830156; 11393518; 27721831; 2236290; 27569885; 27569885; 22119065; 22906882	http://acgpubs.org/RNP/2009/Volume%203/Issue%201/11_RNP_0811_55.pdf; 10.1016/0031-9422(83)85029-8; 10.1016/0031-9422(83)85029-8; 10.1016/j.bse.2007.05.009; 10.1016/S0367-326X(00)00154-4; 10.1016/S0031-9422(96)00559-6; 10.1016/S0031-9422(01)00067-X; https://www.ncbi.nlm.nih.gov/pmc/articles/PMC5046036/pdf/IJMICRO2016-7352509.pdf; 10.1055/s-2006-960985; 10.1016/j.apjtm.2016.06.009; 10.1016/j.apjtm.2016.06.009; 10.1002/hlca.201200359; 10.3923/JM.2017.218.228; 10.1016/j.phytochem.2011.09.002; 10.1016/j.phytochem.2012.05.019; 10.1016/j.phytol.2014.03.007	antibacterial; molluscicidal
Mol_07665	Alpha-ionone	CC(=O)/C=C/C1C(=CCCC1(C)C)C	5282108	Terpenoid	Monoterpene	Gynandropsis gynandra	Gynandropsis gynandra essential oil and its constituents as tick (Rhipicephalus appendiculatus) repellents	12789127	10.1016/S0031-9422(98)00507-X	
Mol_01419	Alpha-phellandrene	CC1=CCC(C=C1)C(C)C	7460	Terpenoid	Monoterpene	Diplotaxis harra; Artemisia herba-alba; Foeniculum vulgare; Cupressus arizonica; Tagetes minuta; Croton zambesicus; Cymbopogon schoenanthus; Juglans regia; Thymus broussonetii; Thymus broussonetti; Thymus maroccanus; Teucrium polium subsp. polium	Antimicrobial components of some cruciferae plants (Diplotaxis harra Forsk. and Erucaria microcarpa Boiss.).; Essential oil from Artemisia herba-alba Asso grown wild in Algeria: variability assessment and comparison with an updated literature survey.; Chemical composition and larvicidal activity of Algerian Foeniculum vulgare seed essential oil; Chemical composition and antimicrobial activity of essential oils of Cupressus arizonica Greene; Chemical composition and Antibacterial activity of essential oils of Tagetes minuta (Asteraceae) against selected plant pathogenic bacteria.; Chemical composition, antiproliferative, antioxidant and antibacterial activities of essential oils from aromatic plants growing in Sudan; Chemical composition, antiproliferative, antioxidant and antibacterial activities of essential oils from aromatic plants growing in Sudan; Phytochemical Investigation by Microwave-Assisted Extraction of Essential Oil of the Leaves of Walnut Cultivated in Algeria; Antibacterial activity of Thymus maroccanus and Thymus broussonetii essential oils against nosocomial infection – bacteria and their synergistic potential with antibiotics; Antimicrobial and insecticidal activities of the Endemic Thymus broussonetti Boiss. and Thymus maroccanus Ball.; Antimicrobial and insecticidal activities of the Endemic Thymus broussonetti Boiss. and Thymus maroccanus Ball.; Chemical and genetic diversity of two Mediterranean subspecies of Teucrium polium L.	27721831; 27569885; 27569885; 22257599; 22906882	10.1002/%28SICI%291099-1573%28199906%2913:4%3C329::AID-PTR458%3E3.0.CO;2-U/epdf; 10.1016/j.arabjc.2012.04.042; 10.1016/j.arabjc.2010.11.006; 10.1016/j.bse.2007.05.009; https://www.ncbi.nlm.nih.gov/pmc/articles/PMC5046036/pdf/IJMICRO2016-7352509.pdf; 10.1016/j.apjtm.2016.06.009; 10.1016/j.apjtm.2016.06.009; 10.1002/hlca.201200359; 10.1016/j.phymed.2011.12.003; 10.3923/JM.2017.218.228; 10.3923/JM.2017.218.228; 10.1016/j.phytochem.2012.05.019	
