Molecule ID	Compound Name	SMILES	PubChem ID	Class	Subclass	Species	References	PMIDs	Links	Bioactivities
Mol_08026	Ent-3,13e-clerodadiene-15-formate	O=COC/C=C(/CC[C@@]1(C)[C@H](CO)CC[C@@]2([C@@H]1CCC=C2C)C)\C		Terpenoid	Diterpenoid	Croton sylvaticus	Diterpenoid derivatives of Kenyan Croton sylvaticus.	25973474	https://www.researchgate.net/publication/275039505_Diterpenoid_Derivatives_of_Kenyan_Croton_sylvaticus	
Mol_08011	Ent-3alpha-hydroxytrachyloban-18-al	O=C[C@@]1(C)[C@H](O)CC[C@@]2([C@@H]1CC[C@]13[C@H]2C[C@@H]2[C@@H](C1)[C@]2(C3)C)C		Terpenoid	Diterpenoid	Croton megalocarpoides	New ent-Clerodane and Abietane Diterpenoids from the Roots of Kenyan Croton megalocarpoides Friis and M. G. Gilbert.	27286332	https://www.thieme-connect.com/products/ejournals/html/10.1055/s-0042-108857	
Mol_08010	Ent-trachyloban-18- oic acid	OC(=O)[C@]1(C)CCC[C@]2([C@H]1CC[C@@]13[C@H]2C[C@H]2[C@@H](C1)[C@]2(C3)C)C	46907039	Terpenoid	Diterpenoid	Croton megalocarpoides; Croton macrostachyus	New ent-Clerodane and Abietane Diterpenoids from the Roots of Kenyan Croton megalocarpoides Friis and M. G. Gilbert.; Phytochemical investigation on the stem bark of Croton macrostachyus (Bisana)	27286332; 25535086	https://www.thieme-connect.com/products/ejournals/html/10.1055/s-0042-108857; http://etd.aau.edu.et/bitstream/123456789/651/2/Zelalem%20Yibralign.pdf	
Mol_08009	Ent-trachyloban-18-ol	OC[C@@]1(C)CCC[C@@]2([C@@H]1CC[C@]13[C@H]2C[C@@H]2[C@@H](C1)[C@]2(C3)C)C		Terpenoid	Diterpenoid	Croton megalocarpoides	New ent-Clerodane and Abietane Diterpenoids from the Roots of Kenyan Croton megalocarpoides Friis and M. G. Gilbert.	27286332	https://www.thieme-connect.com/products/ejournals/html/10.1055/s-0042-108857	
Mol_07984	Epifriedelanol	O[C@H]1CC[C@@H]2[C@]([C@H]1C)(C)CC[C@H]1[C@@]2(C)CC[C@@]2([C@]1(C)CC[C@@]1([C@H]2CC(C)(C)CC1)C)C	119242	Terpenoid	Triterpenoid	Drypetes gerrardii; Kigelia africana; Antidesma chevalieri; Drypetes armoracia	Chemical constituents from the leaves of Drypetes gerrardii; Triterpenes and Lignans from Kigelia africana; Chevalierinoside A: A new isoflavonoid glycoside from the stem bark of Antidesma chevalieri Beille (Euphorbiaceae); Phenolic constituents from Drypetes armoracia.	24680168; 12770597	http://ir-library.ku.ac.ke/handle/123456789/7432; 10.7324/JAPS.2015.58.S1; 10.4314/bcse.v28i2.16; 10.1016/S0031-9422(02)00630-1	
Mol_08064	Ergosterol-5,8-endoperoxide	CC(C/C=C/C[C@H]1CC[C@@H]2[C@]1(C)CCC1[C@]32OO[C@]2([C@]1(C)CCC(C2)O)C=C3)C	10386291	Terpenoid	Triterpenoid	Ajuga remota	The antiplasmodial activity of isolates from Ajuga remota.	12027771	10.1021/np0104626	anti-plasmodial
Mol_08218	Erybraedin a	CC(=CCc1c(O)ccc2c1OCC1C2Oc2c1ccc(c2CC=C(C)C)O)C	362562	Pterocarpan		Erythrina burttii	Three isoflav-3-enes and a 2-arylbenzofuran from the root bark of Erythrina burttii.	11830143	10.1016/S0031-9422(01)00459-9	
Mol_08351	Erycristagallin	CC(=CCc1cc2c(cc1O)OCc1c2oc2c1ccc(c2CC=C(C)C)O)C	10362969	Flavonoid	Isoflavonoid	Erythrina abyssinica; Erythrina abyssinica; Erythrina caffra	8-Methoxyneorautenol and radical scavenging flavonoids from Erythrina abyssinica.; Flavonoids and isoflavonoids with antiplasmodial activities from the root bark of Erythrina abyssinica.; Cyclooxygenase inhibiting and anti-bacterial activities of South African Erythrina species	17489632; 12898424	https://www.ajol.info/index.php/bcse/article/viewFile/44963/28454; https://www.thieme-connect.com/products/ejournals/html/10.1055/s-2003-41119; 10.1016/S0378-8741(00)00366-4	radical scavenging towards 2;2-diphenyl-1-picrylhydrazyl radical (dpph); anti-plasmodial
Mol_16637	Erysacleuxin c	COc1c(O)cc(cc1CC(=O)C(C)C)c1coc2c(c1=O)c(O)cc(c2)O		Flavonoid	Isoflavone	Erythrina sacleuxii	Erysacleuxins C and D, new isoflavones from the twigs of Erythrina sacleuxii Hua and their cytotoxic activity		10.1016/j.arabjc.2019.05.007	
Mol_16638	Erysacleuxin d	COc1c(O)cc(cc1/C=C/C(=O)C)c1coc2c(c1=O)c(O)cc(c2)O		Flavonoid	Isoflavone	Erythrina sacleuxii	Erysacleuxins C and D, new isoflavones from the twigs of Erythrina sacleuxii Hua and their cytotoxic activity		10.1016/j.arabjc.2019.05.007	
Mol_08503	Erysubin f	CC(=CCc1cc(ccc1O)c1coc2c(c1=O)ccc(c2CC=C(C)C)O)C	12051847	Flavonoid	Isoflavone	Erythrina sacleuxii	Antiplasmodial flavonoids from Erythrina sacleuxii.	16491458	https://www.thieme-connect.com/products/ejournals/html/10.1055/s-2005-873200	anti-plasmodial
Mol_08219	Erythrabyssin ii	CC(=CCc1cc2c(cc1O)OC[C@@H]1[C@H]2Oc2c1ccc(c2CC=C(C)C)O)C	10408212	Flavonoid	Pterocarpan	Erythrina burttii; Erythrina abyssinica; Erythrina abyssinica	Three isoflav-3-enes and a 2-arylbenzofuran from the root bark of Erythrina burttii.; Flavonoids and isoflavonoids with antiplasmodial activities from the root bark of Erythrina abyssinica.; Ethnobotanical drug discovery based on medicine men's trials in the African savanna: screening of east African plants for antimicrobial activity II.	11830143; 12898424; 8254349	10.1016/S0031-9422(01)00459-9; https://www.thieme-connect.com/products/ejournals/html/10.1055/s-2003-41119; 10.1021/np50099a012	anti-plasmodial; antimicrobial
Mol_08206	Erythrinasinate	CCCCCCCCCCCCCCCCCCCCCCCCCCCCOC(=O)/C=C/c1ccc(c(c1)OC)O	5743442	Flavonoid	Isoflavonoid	Erythrina burttii; Erythrina sacleuxii; Croton oligandrus	Two prenylated flavanones from stem bark of Erythrina burttii; Two isoflavanones from the stem bark of Erythrina sacleuxii.; Ent-Clerodane Diterpenes from the Bark of Croton oligandrus Pierre ex Hutch. and Assessment of Their Cytotoxicity against Human Cancer Cell Lines	13679101; 11140607; 29438356	10.1016/S0031-9422(97)00945-X; 10.1016/S0031-9422(00)00349-6; 10.3390/molecules23020410	
Mol_08350	Eryvarin l	COc1cc(O)c(cc1c1oc2c(c1)ccc(c2)O)OC	11471684	Flavonoid		Erythrina abyssinica	8-Methoxyneorautenol and radical scavenging flavonoids from Erythrina abyssinica.	17489632	https://www.ajol.info/index.php/bcse/article/viewFile/44963/28454	radical scavenging towards 2;2-diphenyl-1-picrylhydrazyl radical (dpph)
Mol_04544	Estragol	COc1ccc(cc1)CC=C	8815	Terpenoid	Monoterpene	Foeniculum vulgare; Ocimum kenyense	Chemical composition and larvicidal activity of Algerian Foeniculum vulgare seed essential oil; Blend effects in the toxicity of the essential oil constituents of Ocimum kilimandscharicum and Ocimum kenyense (Labiateae) on two post-harvest insect pests.	11393518	10.1016/j.arabjc.2010.11.006; 10.1016/S0031-9422(01)00067-X	
Mol_08075	Ethyl isovalerate	CCOC(=O)CC(C)C	7945	Essential oil		Ocimum kenyense	Blend effects in the toxicity of the essential oil constituents of Ocimum kilimandscharicum and Ocimum kenyense (Labiateae) on two post-harvest insect pests.	11393518	10.1016/S0031-9422(01)00067-X	
Mol_05864	Eucalyptol	CC12CCC(CC1)C(O2)(C)C	2758	Terpenoid; Terpenoid	Monoterpenoid; Monoterpene	Launaea resedifolia; Anthemis tigrensis; Conyza newii; Tarchonanthus camphoratus; Ocimum kilimandscharicum; Ocimum kenyense; Plectranthus marrubioides; Tetradenia riparia; Lippia ukambensis; Croton zambesicus; Cyperus rotundus; Juglans regia; Mentha pulegium	Chemical composition and antibacterial activity of the essential oils from Launaea resedifolia L.; Phytochemical investigation on the aerial part of Anthemis tigreensis (chloroform extract); Repellency of essential oils of some Kenyan plants against Anopheles gambiae; Repellency of essential oils of some Kenyan plants against Anopheles gambiae; Blend effects in the toxicity of the essential oil constituents of Ocimum kilimandscharicum and Ocimum kenyense (Labiateae) on two post-harvest insect pests.; Blend effects in the toxicity of the essential oil constituents of Ocimum kilimandscharicum and Ocimum kenyense (Labiateae) on two post-harvest insect pests.; Repellency of essential oils of some Kenyan plants against Anopheles gambiae; Repellency of essential oils of some Kenyan plants against Anopheles gambiae; Repellency of essential oils of some Kenyan plants against Anopheles gambiae; Chemical composition, antiproliferative, antioxidant and antibacterial activities of essential oils from aromatic plants growing in Sudan; Chemical composition, antiproliferative, antioxidant and antibacterial activities of essential oils from aromatic plants growing in Sudan; Phytochemical Investigation by Microwave-Assisted Extraction of Essential Oil of the Leaves of Walnut Cultivated in Algeria; Influence of in vitro growth conditions in the production of defence compounds in Mentha pulegium L.	22373506; 16766003; 15474566; 15474566; 11393518; 11393518; 15474566; 15474566; 15474566; 27569885; 27569885	10.1186/2191-2858-2-2; http://etd.aau.edu.et/handle/123456789/671; 10.1016/j.phytochem.2004.08.035; 10.1016/j.phytochem.2004.08.035; 10.1016/S0031-9422(01)00067-X; 10.1016/S0031-9422(01)00067-X; 10.1016/j.phytochem.2004.08.035; 10.1016/j.phytochem.2004.08.035; 10.1016/j.phytochem.2004.08.035; 10.1016/j.apjtm.2016.06.009; 10.1016/j.apjtm.2016.06.009; 10.1002/hlca.201200359; 10.1016/j.phytol.2014.03.007	antimicrobial; insect attractant
Mol_07961	Eucleanal	COc1cc(O)c2c(c1)cccc2C=O		Napthalene		Euclea divinorum	Eucleanal: a new naphthalene derivative from Euclea divinorum.	22474953	http://etd-library.ku.ac.ke/bitstream/handle/123456789/8620/Eucleanal%20A%20New%20Napthalene%20....pdf?sequence=4&isAllowed=y	
Mol_07962	Eucleanal a	O=Cc1cc(OC)cc2c1c(O)ccc2	130035047	Napthalene		Euclea divinorum	Eucleanal A and B: Two new napthalene derivatives from Euclea divinorum	22474953	10.1016/j.cclet.2012.01.024	
Mol_07963	Eucleanal b	COc1cc(C=O)c2c(c1O)cccc2OC	162889964	Napthalene		Euclea divinorum	Eucleanal A and B: Two new napthalene derivatives from Euclea divinorum	22474953	10.1016/j.cclet.2012.01.024	
Mol_08104	Eugenol	C=CCc1ccc(c(c1)OC)O	3314	Essential oil; Terpenoid	Monoterpene	Plectranthus marrubioides; Thymus maroccanus	Repellency of essential oils of some Kenyan plants against Anopheles gambiae; Antimicrobial and insecticidal activities of the Endemic Thymus broussonetti Boiss. and Thymus maroccanus Ball.	15474566	10.1016/j.phytochem.2004.08.035; 10.3923/JM.2017.218.228	
Mol_03608	Evoxine	COc1c(OCC(C(O)(C)C)O)ccc2c1nc1occc1c2OC	73416	Alkaloid	Furoquinoline alkaloid	Haplophyllum tuberculatum; Vepris glomerata	Alkaloid, lignan and flavonoid constituents of Haplophyllum tuberculatum from Sudan; A novel flavonoid and furoquinoline alkaloids from Vepris glomerata and their antioxidant activity	17402027; 22312722	10.1055/s-2007-971491; https://www.researchgate.net/publication/221813042_A_Novel_Flavonoid_and_Furoquinoline_Alkaloids_from_Vepris_glomerata_and_their_Antioxidant_Activity	
Mol_09351	Excoecariatoxin	CCCCC/C=C/C=C/C12O[C@H]3[C@@](O1)(C[C@H](C1(O2)[C@H]3[C@@H]2O[C@@]2([C@H]([C@]2([C@H]1C=C(C2=O)C)O)O)CO)C)C(=C)C	6442008	Terpenoid	Daphnane diterpene ester	Synaptolepis kirkii; Synaptolepis kirkii	Study of biological active principles from Kenyan medicinal plants; Neurotrophic and antileukemic daphnane diterpenoids from Synaptolepis kirkii	12150870	http://lib.ugent.be/fulltxt/RUG01/000/695/119/RUG01-000695119_2010_0001_AC.pdf; 10.1016/S0968-0896(02)00163-3	
Mol_09807	Fagaramide	CC(CNC(=O)/C=C/c1ccc2c(c1)OCO2)C	5281772	Alkaloid	Amide	Zanthoxylum gilletii; Zanthoxylum gilletii; Fagara heitzii	Antimalarial compounds containing an alpha,beta-unsaturated carbonyl moiety from Tanzanian medicinal plants.; Cytotoxicity of lupeol from the stem bark of Zanthoxylum gilletii against multi-factorial drug resistant cancer cell lines; Oxidative burst inhibitory and cytotoxic amides and lignans from the stem bark of Fagara heitzii (Rutaceae).	2236290; 19747699	10.1055/s-2006-960985; https://www.investchempharma.com/cytotoxicity-of-lupeol-from-the-stem-bark-of-zanthoxylum-gilletii-against-multi-factorial-drug-resistant-cancer-cell-lines-2/; 10.1016/j.phytochem.2009.08.007	antimalarial; suppressive on phagocytosis response upon activation with serum
Mol_07904	Famesylic acid	C/C(=C\CC/C(=C/C(=O)O)/C)/CCC=C(C)C	5275507	Lipid	Fatty acid	Conyza stricta	Terpenoids from Conyza stricta	26208861	10.1016/0031-9422(90)85226-6	
Mol_07923	Farnesylamine	NC/C=C(/CC/C=C(/CCC=C(C)C)\C)\C	6449783	Terpenoid	Sesquiterpene amine	Vernonia auriculifera; Vernonia auriculifera	Triterpenoids from Vernonia auriculifera Hiern exhibit antimicrobial activity; The phytochemistry and biological activity of secondary metabolites from Kenyan Vernonia and Vepris species	26208861; 26208861	http://www.academicjournals.org/journal/AJPP/article-abstract/E1CC7A033259; http://r.search.yahoo.com/_ylt=A0LEVw56_NVYklIA6wdXNyoA;_ylu=X3oDMTBybGY3bmpvBGNvbG8DYmYxBHBvcwMyBHZ0aWQDBHNlYwNzcg--/RV=2/RE=1490447610/RO=10/RU=http%3a%2f%2fresearchspace.ukzn.ac.za%2fbitstream%2fhandle%2f10413%2f9707%2fKiplimo_Joyce_Jepkorir_2012.pdf%3bsequence%3d1/RK=0/RS=vUjfDhOQDY57aKNmCQGBZiZ2ecg-	
Mol_04542	Fenchone	O=C1C2(C)CCC(C1(C)C)C2	14525	Terpenoid	Monoterpene	Foeniculum vulgare; Plectranthus marrubioides; Cymbopogon schoenanthus; Teucrium polium subsp. polium	Chemical composition and larvicidal activity of Algerian Foeniculum vulgare seed essential oil; Repellency of essential oils of some Kenyan plants against Anopheles gambiae; Chemical composition, antiproliferative, antioxidant and antibacterial activities of essential oils from aromatic plants growing in Sudan; Chemical and genetic diversity of two Mediterranean subspecies of Teucrium polium L.	15474566; 27569885; 22906882	10.1016/j.arabjc.2010.11.006; 10.1016/j.phytochem.2004.08.035; 10.1016/j.apjtm.2016.06.009; 10.1016/j.phytochem.2012.05.019	
Mol_04849	Ferruginol	CC(c1cc2CC[C@@H]3[C@](c2cc1O)(C)CCCC3(C)C)C	442027	Terpenoid; Terpenoid	Diterpenoid; Diterpene	Juniperus phoenicea; Tetraclinis articulata; Cupressus arizonica; Fuerstia africana; Clerodendrum eriophyllum; Salvia jaminiana	Chemical compounds from Phoenician juniper berries (Juniperus phoenicea); Diterpenoids from Tetraclinis articulata that inhibit various human leukocyte functions; Chemical composition and antimicrobial activity of essential oils of Cupressus arizonica Greene; An antimalarial abietane diterpene from Fuerstia africana T.C.E. Fries; Antimicrobial and antiparasitic abietane diterpenoids from the roots of Clerodendrum eriophyllum; Components and antibacterial activity of the roots of Salvia jaminiana	12828472; 23401280; 20614808; 15893885	10.1080/14786419.2010.523827; 10.1021/np0204949; 10.1016/j.bse.2007.05.009; 10.1016/j.bse.2005.08.002; https://www.ncbi.nlm.nih.gov/pmc/articles/PMC3697071/; 10.1016/j.fitote.2005.03.011	antibacterial; antimalarial; anti-leishmanial
Mol_08493	Ferrugone	COc1c2OCOc2c(cc1c1coc2c(c1=O)ccc1c2C=CC(O1)(C)C)OC	324529	Flavonoid	Isoflavone	Millettia dura	6-Methoxycalpogonium Isoflavone A:  A New Isoflavone from the Seed Pods of Millettia dura.	16483619	10.1021/np9605955	
Mol_13267	Fisetin	Oc1ccc2c(c1)oc(c(c2=O)O)c1ccc(c(c1)O)O	5281614	Flavonoid	Flavonol	Ocimum kilimandscharicum; Senecio angulatus	Chemical constituents of Ocimum kilimandscharicum Guerke acclimatized in Kakamega forest, Kenya; LC-ESI/MS-phytochemical profiling with antioxidant and antiacetylcholinesterase activities of Algerian Senecio angulatus L.f. extracts	34219549	10.4314/bcse.v33i3.13; 10.1080/14786419.2021.1947274	
Mol_11308	Flemichapparin b	COc1ccc2c(c1)OCc1c2oc2c1cc1c(c2)OCO1	11822566	Flavonoid	Pterocarpan	Millettia macrophylla; Millettia dura	Estrogenic and cytotoxic potentials of compounds isolated from Millettia macrophylla Benth (Fabaceae): towards a better understanding of its underlying mechanisms.; Flavonoids and Isoflavonoids of Millettia dura and Millettia ferruginea: Phytochemical review and chemotaxonomic values	27784319	10.1186/s12906-016-1385-5; 10.1016/j.bse.2020.104053	
Mol_09213	Flindersiamine	COc1c2OCOc2cc2c1nc1occc1c2OC	68221	Alkaloid	Furoquinoline alkaloid	Vepris uguenensis; Vepris uguenensis; Teclea simplicifolia; Vepris uguenensis; Araliopsis soyauxii	Ring A-seco limonoids and flavonoids from the Kenyan Vepris uguenensis Engl. and their antioxidant activity; An azole, an amide and a limonoid from Vepris uguenensis (Rutaceae); Phytochemical investigation of the stem bark and the leaves of Teclea simplicifolia for analgesic activity; The phytochemistry and biological activity of secondary metabolites from Kenyan Vernonia and Vepris species; Furoquinolines and dihydrooxazole alkaloids with cytotoxic activity from the stem bark of Araliopsis soyauxii.	22898386; 18267321; 18267321; 26208861; 30654126	10.1016/j.phytochem.2012.06.025; 10.1016/j.phytochem.2007.12.013; http://sps.uonbi.ac.ke/sites/default/files/cbps/sps/sps/daisy%20final%20thesis.pdf; http://r.search.yahoo.com/_ylt=A0LEVw56_NVYklIA6wdXNyoA;_ylu=X3oDMTBybGY3bmpvBGNvbG8DYmYxBHBvcwMyBHZ0aWQDBHNlYwNzcg--/RV=2/RE=1490447610/RO=10/RU=http%3a%2f%2fresearchspace.ukzn.ac.za%2fbitstream%2fhandle%2f10413%2f9707%2fKiplimo_Joyce_Jepkorir_2012.pdf%3bsequence%3d1/RK=0/RS=vUjfDhOQDY57aKNmCQGBZiZ2ecg-; 10.1016/j.fitote.2019.01.003	antimalarial
Mol_08468	Formononetin	COc1ccc(cc1)c1coc2c(c1=O)ccc(c2)O	5280378	Flavonoid	Isoflavonoid	Platycelyphium voënse; Millettia dura; Bolusanthus speciosus; Dalbergia melanoxylon; Taverniera abyssinica; Pycnanthus anglonensis; Staudtia kamerunensis; Millettia lasiantha	Four isoflavanones from the stem bark of Platycelphium voënse.; 6-Methoxycalpogonium Isoflavone A:  A New Isoflavone from the Seed Pods of Millettia dura.; Antimicrobial and antioxidant flavonoids from the root wood of Bolusanthus speciosus.; 3-Hydroxyisoflavanones from the stem bark of Dalbergia melanoxylon: Isolation, antimycobacterial evaluation and molecular docking studies.; Isoflavonoids from Taverniera abyssinica.; Pycnangloside: A New Cerebroside from Bark of Pycnanthus Angolensis; Antibacterial activity of flavonoids and triterpenoids isolated from the stem bark and sap of Staudtia kamerunensis Warb. (Myristicaceae); A coumestan and a coumaronochromone from Millettia lasiantha	16483619; 16483619; 15081287; 17234222; 19173126; 21213984	10.1016/j.phytol.2011.11.012; 10.1021/np9605955; 10.1016/j.phytochem.2004.02.011; 10.1016/j.phytol.2013.08.018; https://www.ajol.info/index.php/bcse/article/viewFile/79574/69854; 10.1177/1934578X1000501121; 10.1016/j.arabjc.2022.104150; 10.1016/j.bse.2021.104277	antimicrobial; radical scavenging against dpph; antimycobacterial
Mol_07991	Friedelane-3,7-dione	O=C1C[C@]2(C)[C@@H](C)C(=O)CCC2[C@]2(C1[C@@]1(C)CC[C@@]3(C([C@@]1(CC2)C)CC(CC3)(C)C)C)C		Terpenoid	Triterpenoid	Drypetes gerrardii; Drypetes tessmanniana	Chemical constituents from the leaves of Drypetes gerrardii; Antimicrobial activity of the methanolic extract and compounds from the stem bark of Drypetes tessmanniana.	24680168; 20697945	http://ir-library.ku.ac.ke/handle/123456789/7432; 10.1007/s11655-010-0527-8	
Mol_07985	Friedelanol methyl ether	CO[C@]1(C)CCC2[C@]([C@H]1C)(C)CC(=C)C1[C@@]2(C)CC[C@@]2([C@]1(C)CC[C@@]1(C2CC(C)(C)CC1)C)C		Terpenoid	Triterpenoid	Drypetes gerrardii	Chemical constituents from the leaves of Drypetes gerrardii	24680168	http://ir-library.ku.ac.ke/handle/123456789/7432	
Mol_07929	Friedelin acetate	CC(=O)OC1CC[C@@H]2[C@]([C@H]1C)(C)CC[C@H]1[C@@]2(C)CC[C@@]2([C@]1(C)CC[C@@]1([C@H]2CC(C)(C)CC1)C)C	13688750	Terpenoid	Triterpenoid	Vernonia auriculifera; Vernonia auriculifera	Triterpenoids from Vernonia auriculifera Hiern exhibit antimicrobial activity; The phytochemistry and biological activity of secondary metabolites from Kenyan Vernonia and Vepris species	26208861; 26208861	http://www.academicjournals.org/journal/AJPP/article-abstract/E1CC7A033259; http://r.search.yahoo.com/_ylt=A0LEVw56_NVYklIA6wdXNyoA;_ylu=X3oDMTBybGY3bmpvBGNvbG8DYmYxBHBvcwMyBHZ0aWQDBHNlYwNzcg--/RV=2/RE=1490447610/RO=10/RU=http%3a%2f%2fresearchspace.ukzn.ac.za%2fbitstream%2fhandle%2f10413%2f9707%2fKiplimo_Joyce_Jepkorir_2012.pdf%3bsequence%3d1/RK=0/RS=vUjfDhOQDY57aKNmCQGBZiZ2ecg-	
Mol_07183	Gaboroquinone a	OCc1cc(O)c2c(c1c1c(O)cc(c(c1OC)C(=O)C)O)C(=O)c1c(C2=O)c(O)ccc1	10072444	Quinone	Anthraquinone	Bulbine frutescens	Joziknipholones A and B: the first dimeric phenylanthraquinones, from the roots of Bulbine frutescens	18067107	10.1002/chem.200701328/full	
Mol_07184	Gaboroquinone b	OCc1cc(O)c2c(c1c1c(O)cc(c(c1O)C(=O)C)OC)C(=O)c1c(C2=O)c(O)ccc1	636652	Quinone	Anthraquinone	Bulbine frutescens	Joziknipholones A and B: the first dimeric phenylanthraquinones, from the roots of Bulbine frutescens	18067107	10.1002/chem.200701328/full	
Mol_08663	Galegine	CC(=CCN=C(N)N)C	10983	Alkaloid	Guanidine alkaloid	Galega lindblomi	The alkaloids of two species of Afrogalega.	19173126	10.1016/S0305-1978(02)00224-7	
Mol_00278	Gallic acid	OC(=O)c1cc(O)c(c(c1)O)O	370	Phenolic; Tannin	Polyphenol	Schinus molle; Harpephyllum caffrum; Mangifera indica; Hyphaene thebaica; Pteranthus dichotomus; Helianthemum sessiliflorum; Terminalia species; Terminalia arjuna; Arbutus unedo; Euphorbia species; Euphorbia helioscopia; Lagerstroemia indica; Melaleuca quinquenervia; Epilobium hirsutum; Oligomeris linifolia; Sanguisorba minor; Reaumuria vermiculata; Coriandrum sativum; Juniperus phoenicea; Moringa oleifera; Maesa lanceolata; Myrsine africana; Achyranthes aspera; Acacia nilotica subsp. tomentosa; Acacia species; Acacia farnesiana	Antioxidant flavonol glycosides from Schinus molle; Constitutive phenolics of Harpephyllum caffrum (Anacardiaceae) and their biological effects on human keratinocytes; Benzophenone C-glucosides and gallotannins from mango tree stem bark with broad-spectrum anti-viral activity; Potential superoxide anion radical scavenging activity of doum palm (Hyphaene thebaica L.) leaves extract; New flavonoid glycoside and pharmacological activities of Pteranthus dichotomus Forssk.; Lignans and other constituents from Helianthemum sessiliflorum Pers.; Polyphenolic compounds in the fruits of Egyptian medicinal plants (Terminalia bellerica, Terminalia chebula and Terminalia horrida): Characterization, quantitation and determination of antioxidant capacities; A tannin anti-cancer promotor from Terminalia arjuna; Tannins and catechin gallate mediate the vasorelaxant effect of Arbutus unedo on the rat isolated aorta; The chemosystematics of Egyptian Euphorbia species; Euphorbia helioscopia: Chemical constituents and biological activities; Anthocyanins of Lagerstroemia indica flowers; Polyphenols of Melaleuca quinquenervia leaves - pharmacological studies of grandinin; Polyphenolic metabolites of Epilobium hirsutum; Phytochemical investigation of Oligomeris linifolia (Vahl) Macbr. (Resedaceae); Unique phenolic carboxylic acids from Sanguisorba minor; Cytotoxic ellagitannins from Reaumuria vermiculata; Antioxidant activity of methanolic extracts from three coriander (Coriandrum sativum L.) fruit varieties; Chemical compounds from Phoenician juniper berries (Juniperus phoenicea); Phenolics of Moringa oleifera leaves.; Triterpene saponins of Maesa lanceolata leaves.; A flavonol glycoside from Myrsine africana leaves.; Antimicrobial, anthelmintic activities and characterisation of functional phenolic acids of Achyranthes aspera linn.: a medicinal plant used for the treatment of wounds and Ringworm in East Africa.; (+)-Catechin-5-galloyl ester as a novel natural polyphenol from the bark of Acacia nilotica of Sudanese origin; Chemotaxonomical and Palynological Studies on Nine Acacia Species Occurring in Sudan; Phenolics from Acacia farnesiana	16521111; 21907269; 24613627; 20451939; 9612958; 15597331; 12916075; 12770593; 22742959; 17365690; 17365690; 17365690; 11054840	10.1002/ptr.1834/abstract; 10.1016/j.fitote.2011.08.014; 10.1016/j.bmc.2014.02.014; http://acgpubs.org/RNP/2008/Volume%202/Issue%201/RNP-0806-25.pdf; http://www.acgpubs.org/RNP/2013/Volume7/Issue%201/11-RNP-1111-819.pdf; http://www.acgpubs.org/RNP/2015/Volume9/Issue%201/43-RNP-1407-141.pdf; 10.1016/j.phytochem.2010.03.018; 10.1016/S0031-9422(97)01078-9; 10.1002/ptr.1513/; 10.1016/0305-1978(90)90119-Z; https://www.researchgate.net/publication/258838908_Euphorbia_helioscopia_Chemical_Constituents_and_Biological_Activities; 10.1016/0031-9422(73)85145-3; 10.1002/ptr.1214; 10.1016/S0031-9422(97)00370-1; 10.1016/j.bse.2013.03.020; 10.1016/S0031-9422(03)00198-5; 10.1016/j.fitote.2012.06.007; 10.1016/j.arabjc.2013.12.011; 10.1080/14786419.2010.523827; 10.1080/14786410601035811; https://www.researchgate.net/profile/Lutz_Tietze/publication/228511680_Triterpene_saponins_of_Maesa_lanceolata_leaves/links/0c9605239b5aacf6b5000000.pdf; 10.1016/S0031-9422(96)00329-9; https://www.ncbi.nlm.nih.gov/pmc/articles/PMC4655238/pdf/fphar-06-00274.pdf; 10.1055/s-2006-962094; 10.5539/jps.v1n2p61; 10.1016/0031-9422(73)85144-1	antioxidant; vasorelaxant; antitumor; antiseptic
