Molecule ID	Compound Name	SMILES	PubChem ID	Class	Subclass	Species	References	PMIDs	Links	Bioactivities
Mol_01597	Myrtenol	OCC1=CCC2CC1C2(C)C	10582	Terpenoid; Terpenoid	Monoterpene alcohol; Monoterpene	Artemisia herba-alba; Commiphora quadricincta; Ocimum kilimandscharicum; Cyperus rotundus; Teucrium polium subsp. polium	Essential oil from Artemisia herba-alba Asso grown wild in Algeria: variability assessment and comparison with an updated literature survey.; Seasonal variation in the essential oil composition of Commiphora quadricincta and its effect on the maturation of immature adults of the desert locust, Schistocerca gregaria; Blend effects in the toxicity of the essential oil constituents of Ocimum kilimandscharicum and Ocimum kenyense (Labiateae) on two post-harvest insect pests.; Chemical composition, antiproliferative, antioxidant and antibacterial activities of essential oils from aromatic plants growing in Sudan; Chemical and genetic diversity of two Mediterranean subspecies of Teucrium polium L.	11830156; 11393518; 27569885; 22906882	10.1016/j.arabjc.2012.04.042; 10.1016/S0031-9422(96)00559-6; 10.1016/S0031-9422(01)00067-X; 10.1016/j.apjtm.2016.06.009; 10.1016/j.phytochem.2012.05.019	
Mol_08804	Mzikonone	CC(=O)O[C@H]1C[C@H]2[C@@](C3=CC[C@H]([C@]13C)c1ccoc1)(C)[C@H](O)C[C@@H]1[C@]2(C)CCC(=O)C1(C)C	14109464	Terpenoid	Limonoid	Turraea parvifolia; Turraea robusta; Turraea nilotica	Limonoids from Turraea parvifolia (Meliaceae); Antiplasmodial and cytotoxic activities of the constituents of Turraea robusta and Turraea nilotica.; Antiplasmodial and cytotoxic activities of the constituents of Turraea robusta and Turraea nilotica.	12648531; 26320684; 26320684	10.1016/S0305-1978(03)00034-6; 10.1016/j.jep.2015.08.039; 10.1016/j.jep.2015.08.039	anti-plasmodial
Mol_13269	N-octacosanoic acid	CCCCCCCCCCCCCCCCCCCCCCCCCCCC(=O)O	10470	Lipid	Saturated fatty acid	Ocimum kilimandscharicum; Quercus suber	Chemical constituents of Ocimum kilimandscharicum Guerke acclimatized in Kakamega forest, Kenya; Chemical composition of leaf cutin in six Quercus suber provenances	33166753	10.4314/bcse.v33i3.13; 10.1016/j.phytochem.2020.112570	
Mol_13232	Naphthalene	c1ccc2c(c1)cccc2	931	Aromatic hydrocarbon	Polycyclic aromatic hydrocarbon	Beauveria bassiana; Hypocrea lixii	Mechanism of Action of Endophytic Fungi Hypocrea lixii and Beauveria bassiana in Phaseolus vulgaris as Biopesticides against Pea Leafminer and Fall Armyworm; Mechanism of Action of Endophytic Fungi Hypocrea lixii and Beauveria bassiana in Phaseolus vulgaris as Biopesticides against Pea Leafminer and Fall Armyworm	34577165; 34577165	10.3390/molecules26185694; 10.3390/molecules26185694	
Mol_02052	Naringenin 7-methyl ether	COc1cc2OC(CC(=O)c2c(c1)O)c1ccc(cc1)O	348130	Flavonoid	Flavonoid aglycone	Artemisia monosperma; Gardenia ternifolia; Dodonaea angustifolia	p-Coumarinic acid derivatives from Artemisia monosperma.; Antioxidant activities of flavonoid aglycones from Kenyan Gardenia ternifolia Schum and Thonn; Antimicrobial flavonoids and diterpenoids from Dodonaea angustifolia	27518587; 12789127	10.1016/0031-9422(90)85231-4; https://www.researchgate.net/profile/Leonidah_Kerubo_Omosa/publication/305114259_Antioxidant_Activities_of_Flavonoid_Aglycones_from_Kenyan_Gardenia_ternifolia_Schum_and_Thonn/links/57825ce108ae9485a43e0122.pdf; 10.1016/j.sajb.2013.11.012	antioxidant
Mol_09290	Neo-clerodan-3,13-dien-16,15:18,19-diolide	COC1C=C(C(=O)O1)CC[C@@]1(C)[C@H](C)CC[C@@]23[C@@H]1CCC=C3C(=O)OC2	131846663	Terpenoid	Neo-clerodane diterpene	Dodonaea angustifolia	neo-Clerodane diterpenoids from the leaf exudate of Dodonaea angustifolia	12789127	10.1016/j.phytol.2010.08.001	
Mol_08202	Neorautenol	Oc1ccc2c(c1)O[C@@H]1[C@H]2COc2c1cc1C=CC(Oc1c2)(C)C	11500744	Flavonoid	Pterocarpan	Erythrina burttii; Erythrina burttii; Erythrina schliebenii	Two prenylated flavanones from stem bark of Erythrina burttii; Antimicrobial flavonoids from the stem bark of Erythrina burttii.; Flavonoids from Erythrina schliebenii.	13679101; 15967591; 28112509	10.1016/S0031-9422(97)00945-X; 10.1016/j.fitote.2005.04.006; 10.1021/acs.jnatprod.6b00839	antimicrobial
Mol_07662	Nerol	OC/C=C(\CCC=C(C)C)/C	643820	Terpenoid	Monoterpene	Gynandropsis gynandra; Teucrium scorodonia L. subsp. baeticum; Teucrium polium subsp. polium	Gynandropsis gynandra essential oil and its constituents as tick (Rhipicephalus appendiculatus) repellents; Chemical and genetic differentiation of two Mediterranean subspecies of Teucrium scorodonia L.; Chemical and genetic diversity of two Mediterranean subspecies of Teucrium polium L.	12789127; 22119065; 22906882	10.1016/S0031-9422(98)00507-X; 10.1016/j.phytochem.2011.09.002; 10.1016/j.phytochem.2012.05.019	
Mol_08826	Niloticin	C[C@H]([C@@H]1CC[C@]2([C@@]1(C)CC[C@H]1C2=CC[C@@H]2[C@]1(C)CCC(=O)C2(C)C)C)C[C@H]([C@@H]1OC1(C)C)O	14021529	Terpenoid	Triterpenoid	Turraea nilotica; Vepris uguenensis; Vepris uguenensis	Antiplasmodial and cytotoxic activities of the constituents of Turraea robusta and Turraea nilotica.; Ring A-seco limonoids and flavonoids from the Kenyan Vepris uguenensis Engl. and their antioxidant activity; The phytochemistry and biological activity of secondary metabolites from Kenyan Vernonia and Vepris species	26320684; 22898386; 26208861	10.1016/j.jep.2015.08.039; 10.1016/j.phytochem.2012.06.025; http://r.search.yahoo.com/_ylt=A0LEVw56_NVYklIA6wdXNyoA;_ylu=X3oDMTBybGY3bmpvBGNvbG8DYmYxBHBvcwMyBHZ0aWQDBHNlYwNzcg--/RV=2/RE=1490447610/RO=10/RU=http%3a%2f%2fresearchspace.ukzn.ac.za%2fbitstream%2fhandle%2f10413%2f9707%2fKiplimo_Joyce_Jepkorir_2012.pdf%3bsequence%3d1/RK=0/RS=vUjfDhOQDY57aKNmCQGBZiZ2ecg-	anti-plasmodial; cytotoxic
Mol_09202	Nitidine	COc1cc2c[n+](C)c3c(c2cc1OC)ccc1c3cc2OCOc2c1	4501	Alkaloid	Benzophenanthridine alkaloid	Toddalia asiatica; Toddalia asiatica; Fagara tessmannii	Potent antimalarial activity of the alkaloid nitidine, isolated from a Kenyan herbal remedy; Anti-HIV Alkaloids from Toddalia asiatica; Oxidative burst inhibition, cytotoxicity and antibacterial acriquinoline alkaloids from Citrus reticulate (Blanco).	8592987; 18267321; 26711890	http://aac.asm.org/content/39/12/2606.abstract; 10.1080/10575639508044104; 10.1016/j.bmcl.2015.12.028	anti-plasmodial; anti-hiv; antibacterial
Mol_09268	Nkolbisine	COc1cc2nc3occc3c(c2cc1OCC(C(O)(C)C)O)OC	157014	Alkaloid	Furoquinoline alkaloid	Vepris glomerata	The phytochemistry and biological activity of secondary metabolites from Kenyan Vernonia and Vepris species	26208861	http://r.search.yahoo.com/_ylt=A0LEVw56_NVYklIA6wdXNyoA;_ylu=X3oDMTBybGY3bmpvBGNvbG8DYmYxBHBvcwMyBHZ0aWQDBHNlYwNzcg--/RV=2/RE=1490447610/RO=10/RU=http%3a%2f%2fresearchspace.ukzn.ac.za%2fbitstream%2fhandle%2f10413%2f9707%2fKiplimo_Joyce_Jepkorir_2012.pdf%3bsequence%3d1/RK=0/RS=vUjfDhOQDY57aKNmCQGBZiZ2ecg-	antioxidant
Mol_09250	Nobiline	CN(CC1CCC2(C1(C)C(=O)C1OC(=O)C2C1C(C)C)O)C	547118	Alkaloid		Teclea simplicifolia	Phytochemical investigation of the stem bark and the leaves of Teclea simplicifolia for analgesic activity	18267321	http://sps.uonbi.ac.ke/sites/default/files/cbps/sps/sps/daisy%20final%20thesis.pdf	
Mol_07329	Nonanal	CCCCCCCCC=O	31289	Aldehyde; Terpenoid	Megastigmane	Syncerus caffer; Bos indicus; Kobus ellipsiprymnus; Commiphora quadricincta; Gynandropsis gynandra; Teucrium scorodonia L. subsp. baeticum; Teucrium polium subsp. polium	Odor composition of preferred (buffalo and ox) and nonpreferred (waterbuck) hosts of some Savanna tsetse flies; Odor composition of preferred (buffalo and ox) and nonpreferred (waterbuck) hosts of some Savanna tsetse flies; Odor composition of preferred (buffalo and ox) and nonpreferred (waterbuck) hosts of some Savanna tsetse flies; Seasonal variation in the essential oil composition of Commiphora quadricincta and its effect on the maturation of immature adults of the desert locust, Schistocerca gregaria; Gynandropsis gynandra essential oil and its constituents as tick (Rhipicephalus appendiculatus) repellents; Chemical and genetic differentiation of two Mediterranean subspecies of Teucrium scorodonia L.; Chemical and genetic diversity of two Mediterranean subspecies of Teucrium polium L.	12049234; 12049234; 12049234; 11830156; 12789127; 22119065; 22906882	10.1023/A:1015205716921; 10.1023/A:1015205716921; 10.1023/A:1015205716921; 10.1016/S0031-9422(96)00559-6; 10.1016/S0031-9422(98)00507-X; 10.1016/j.phytochem.2011.09.002; 10.1016/j.phytochem.2012.05.019	
Mol_07375	Nonanoic acid	CCCCCCCCC(=O)O	8158	Acid; Lipid	Nonanoic acid; Fatty acid	Kobus ellipsiprymnus; Salia triloba	Odor composition of preferred (buffalo and ox) and nonpreferred (waterbuck) hosts of some Savanna tsetse flies; Constituents from Salia triloba	12049234; 11677033	10.1023/A:1015205716921; 10.1016/s0367-326x(01)00327-6	
Mol_08164	Nordurlettone	CC(=CCOc1ccc(cc1)c1coc2c(c1=O)ccc(c2)O)C	44257226	Flavonoid	Isoflavone	Millettia dura; Millettia dura	A new isoflavone from stem bark of Millettia dura; 4'-Prenyloxyderrone from the stem bark of Millettia oblata ssp. teitensis and the antiplasmodial activities of isoflavones from some Millettia species.	23401280; 14561074	https://www.ajol.info/index.php/bcse/article/viewFile/20933/3918; 10.1016/j.phytol.2014.02.001	anti-plasmodial
Mol_08194	Norisojamicin	Oc1cc(cc2c1OCO2)c1coc2c(c1=O)ccc1c2C=CC(O1)(C)C	101938912	Flavonoid	Isoflavone	Millettia usaramensis usaramensis; Millettia griffoniana	Rotenoids, isoflavones and chalcones from the stem bark of Millettia usaramensis subspecies usaramensis; Isoflavonoids from Seeds of Millettia griffoniana (Bail)	13679101	http://ac.els-cdn.com/S003194229700424X/1-s2.0-S003194229700424X-main.pdf?_tid=872b02f4-13af-11e7-9d48-00000aab0f27&acdnat=1490703206_ef706f4117f7835273c5765a438836b5; 10.1515/znb-2005-0911	
Mol_09177	Normelicopicine	COc1c(OC)c(OC)c2c(c1O)c(=O)c1c(n2C)cccc1	5378563	Alkaloid		Teclea trichocarpa	Isolation and in vitro antiplasmodial activities of alkaloids from Teclea trichocarpa: in vivo antimalarial activity and X-ray crystal structure of normelicopicine	12141852	10.1021/np0106182	anti-plasmodial
Mol_07935	Nystatin	OC1CCC(O)C(O)C[C@]2(O)CC(O)C(C(O2)CC(/C=C/C=C/C=C/C=C/CC/C=C/C=C/[C@@H]([C@H]([C@H]([C@@H](OC(=O)CC(CC(C1)O)O)C)C)O)C)O[C@H]1O[C@H](C)[C@H]([C@@H]([C@@H]1O)N)O)C(=O)O	6433272	Polyene		Vernonia urticifolia; Vernonia urticifolia	Novel polyene from Vernonia urticifolia (Asteraceae); The phytochemistry and biological activity of secondary metabolites from Kenyan Vernonia and Vepris species	26208861; 26208861	http://www.academicjournals.org/journal/JMPR/article-abstract/231BC8423484; http://r.search.yahoo.com/_ylt=A0LEVw56_NVYklIA6wdXNyoA;_ylu=X3oDMTBybGY3bmpvBGNvbG8DYmYxBHBvcwMyBHZ0aWQDBHNlYwNzcg--/RV=2/RE=1490447610/RO=10/RU=http%3a%2f%2fresearchspace.ukzn.ac.za%2fbitstream%2fhandle%2f10413%2f9707%2fKiplimo_Joyce_Jepkorir_2012.pdf%3bsequence%3d1/RK=0/RS=vUjfDhOQDY57aKNmCQGBZiZ2ecg-	
Mol_08474	Obovatachalcone	COc1cc2OC(C)(C)C=Cc2c(c1C(=O)/C=C/c1ccccc1)O	11056805	Flavonoid		Tephrosia elata	Antiplasmodial β-hydroxydihydrochalcone from seedpods of Tephrosia elata	16483619	10.1016/j.phytol.2009.01.002	anti-plasmodial
Mol_08475	Obovatin	O=C1CC(Oc2c1c(O)cc1c2C=CC(O1)(C)C)c1ccccc1	13940732	Flavonoid		Tephrosia elata	Antiplasmodial β-hydroxydihydrochalcone from seedpods of Tephrosia elata	16483619	10.1016/j.phytol.2009.01.002	anti-plasmodial
Mol_08382	Obovatin methyl ether	COc1cc2OC(C)(C)C=Cc2c2c1C(=O)CC(O2)c1ccccc1	2729164	Flavonoid	Pyranoflavonoid	Tephrosia purpurea; Tephrosia vogelii; Tephrosia elata	6α-Hydroxy-α-toxicarol and (+)-tephrodin with antiplasmodial activities from Tephrosia species.; Distinct chemotypes of Tephrosia vogelii and implications for their use in pest control and soil enrichment.; Antiplasmodial β-hydroxydihydrochalcone from seedpods of Tephrosia elata	22575309; 22483325; 16483619	http://www.sciencedirect.com/science/article/pii/S1874390014001621; http://www.sciencedirect.com/science/article/pii/S0031942212001057; 10.1016/j.phytol.2009.01.002	anti-plasmodial
Mol_07328	Octanal	CCCCCCCC=O	454	Aldehyde	Octanal	Syncerus caffer	Odor composition of preferred (buffalo and ox) and nonpreferred (waterbuck) hosts of some Savanna tsetse flies	12049234	10.1023/A:1015205716921	
Mol_09755	Ohchinin-3-acetate	COC(=O)C[C@@H]1[C@@]2(C)[C@@H](OC(=O)/C=C/c3ccccc3)C[C@H]([C@@]3([C@@H]2[C@H]([C@@H]2[C@@]1(C)C1=C(C)[C@@H](C[C@H]1O2)c1ccoc1)OC3)C)OC(=O)C	52952322	Terpenoid	Tetranortriterpene	Melia volkensii	Tetranortriterpenes from Melia volkensii.	21401202	10.1021/np50059a004	
Mol_00068	Oleanolic acid	O[C@H]1CC[C@]2([C@H](C1(C)C)CC[C@@]1([C@@H]2CC=C2[C@@]1(C)CC[C@@]1([C@H]2CC(C)(C)CC1)C(=O)O)C)C	10494	Terpenoid	Triterpene	Viburnum tinus; Atractylis flava; Eucalyptus occidentalis; Withania adpressa; Ammi majus; Lantana montevidensis; Vernonia auriculifera; Vernonia auriculifera; Leucas aspera; Baillonella toxisperma; Lavandula multifida; Salia triloba; Amaracus akhdarensis; Amaracus pampanini; Salvia lanigera; Salvia triloba; Salvia palaestina; Lavandula multifida	Phytochemical constituents and hepatoprotective activity of Viburnum tinus; Flavonoid glycosides and triterpenoids from Atractylis flava.; Isolation from Eucalyptus occidentalis and identification of a new kaempferol derivative that induces apoptosis in human myeloid leukemia cells; Withanolides from Withania adpressa; Coumarins and coumarin glucosides from the fruits of Ammi majus; New pentacyclic triterpenoid from the roots of Lantana montevidensis (spreng.) briq. cultivated in Egypt; Triterpenoids from Vernonia auriculifera Hiern exhibit antimicrobial activity; The phytochemistry and biological activity of secondary metabolites from Kenyan Vernonia and Vepris species; Chemical studies of Leucas martinicensis; Lupane derivatives: Design, isolation, synthesis and evaluation of antiplasmodial activity against Plasmodium falciparum 3D7 strain; Extracts and constituents of Lavandula multifida with topical anti-inflammatory activity; Constituents from Salia triloba; Diterpenes from the genus Amaracus; Diterpenes from the genus Amaracus; The triterpenoid acids of Salvia lanigera Poir. and S. triloba L; The triterpenoid acids of Salvia lanigera Poir. and S. triloba L; Modified abietane diterpenoids and a methoxylupane derivative from Salvia palaestina; Extracts and constituents of Lavandula multifida with topical anti-inflammatory activity	16303155; 15104478; 26208861; 26208861; 23401280; 15898704; 11677033; 38458316; 15898704	http://www.sciencedirect.com/science/article/pii/S0031942205003596; 10.1016/j.phytol.2012.10.004; 10.1021/np049960f; 10.1002/hlca.200790041/abstract; 10.1016/0031-9422(93)85365-X; 10.1055/s-0035-1545209; http://www.academicjournals.org/journal/AJPP/article-abstract/E1CC7A033259; http://r.search.yahoo.com/_ylt=A0LEVw56_NVYklIA6wdXNyoA;_ylu=X3oDMTBybGY3bmpvBGNvbG8DYmYxBHBvcwMyBHZ0aWQDBHNlYwNzcg--/RV=2/RE=1490447610/RO=10/RU=http%3a%2f%2fresearchspace.ukzn.ac.za%2fbitstream%2fhandle%2f10413%2f9707%2fKiplimo_Joyce_Jepkorir_2012.pdf%3bsequence%3d1/RK=0/RS=vUjfDhOQDY57aKNmCQGBZiZ2ecg-; http://etd.aau.edu.et/bitstream/123456789/530/2/ESTIFANOS%20ELE.pdf; 10.1016/j.phytol.2023.06.009; 10.1016/j.phymed.2004.02.007; 10.1016/s0367-326x(01)00327-6; 10.1021/np50035a027; 10.1021/np50035a027; 10.1016/S0031-9422(00)86058-6; 10.1016/S0031-9422(00)86058-6; 10.1016/S0031-9422(97)00251-3; 10.1016/j.phymed.2004.02.007	antibacterial; anti-inflammatory
Mol_04722	Oleanonic acid	OC(=O)[C@]12CC[C@@]3(C(=CC[C@H]4[C@@]3(C)CC[C@@H]3[C@]4(C)CCC(=O)C3(C)C)[C@@H]2CC(CC1)(C)C)C	12313704	Terpenoid	Triterpenoid	Lantana montevidensis; Ekebergia capensis; Ekebergia capensis	New pentacyclic triterpenoid from the roots of Lantana montevidensis (spreng.) briq. cultivated in Egypt; Antiplasmodial triterpenoids from Ekebergia capensis.; Constituents of the roots and leaves of Ekebergia capensis and their potential antiplasmodial and cytotoxic activities.	18220356; 25211004	10.1055/s-0035-1545209; 10.1021/np0780093; http://www.mdpi.com/1420-3049/19/9/14235/htm	cytotoxic; anti-plasmodial
Mol_16658	Osajin	CC(=CCc1c2OC(C)(C)C=Cc2c2c(c1O)c(=O)c(co2)c1ccc(cc1)O)C	95168	Flavonoid	Isoflavone	Ormocarpum kirkii	Cytotoxicity of isoflavones and biflavonoids from Ormocarpum kirkii towards multi-factorial drug resistant cancer		10.1016/j.phymed.2019.152853	anticancer
Mol_01223	P-coumaric acid	OC(=O)/C=C/c1ccc(cc1)O	637542	Phenolic; Phenylpropanoid	Hydroxycinnamic acid	Pteranthus dichotomus; Ephedra alata; Ephedra aphylla; Epilobium hirsutum; Limoniastrum guyonianum; Apis species; Cotoneaster orbicularis; Coriandrum sativum; Bulbine frutescens; Vepris glomerata; Vepris glomerata; Achyranthes aspera; Sanghuangporus sp.; Plumeria rubra; Halimium halimifolium; Ononis natrix; Crataegus azarolus; Retama raetam	New flavonoid glycoside and pharmacological activities of Pteranthus dichotomus Forssk.; Alkaloidal, lignan and phenolic constituents of Ephedra alata; Flavonoids from Ephedra aphylla; Polyphenolic metabolites of Epilobium hirsutum; Phenolic contents and biological activities of Limoniastrum guyonianum fractions obtained by Centrifugal Partition Chromatography; Polyphenolic fraction of Algerian propolis protects rat kidney against acute oxidative stress induced by doxorubicin; Unusual phenolic glycosides from Cotoneaster orbicularis; Antioxidant activity of methanolic extracts from three coriander (Coriandrum sativum L.) fruit varieties; Joziknipholones A and B: the first dimeric phenylanthraquinones, from the roots of Bulbine frutescens; Antibacterial activity of an epoxidised prenylated cinnamaldehdye derivative from Vepris glomerata; The phytochemistry and biological activity of secondary metabolites from Kenyan Vernonia and Vepris species; Antimicrobial, anthelmintic activities and characterisation of functional phenolic acids of Achyranthes aspera linn.: a medicinal plant used for the treatment of wounds and Ringworm in East Africa.; Sesquiterpenes from an Eastern African medicinal mushroom belonging to the genus Sanghuangporus.; Minor secondary metabolic products from the stem bark of Plumeria rubra Linn. displaying antimicrobial activities; Halimium halimifolium: From the Chemical and Functional Characterization to a Nutraceutical Ingredient Design; Chemical composition, antioxidant and antimicrobial activities of the edible medicinal Ononis natrix growing wild in Tunisia; Wild grown red and yellow hawthorn fruits from Tunisia as source of antioxidants; Analgesic and Antioxidant Activities of Algerian Retama raetam (Forssk.) Webb & Berthel Extracts	3132328; 10746883; 18067107; 22898386; 26208861; 11054840; 31001977; 19937550; 31261420; 25471464	http://www.acgpubs.org/RNP/2013/Volume7/Issue%201/11-RNP-1111-819.pdf; 10.1016/S0031-9422(00)84920-1; 10.1016/S0031-9422(97)00092-7; 10.1016/S0031-9422(97)00370-1; 10.1016/j.indcrop.2013.06.011; 10.4103/0971-4065.82131; 10.1016/S0031-9422(99)00598-1; 10.1016/j.arabjc.2013.12.011; 10.1002/chem.200701328/full; 10.1016/j.phytol.2012.03.017; http://r.search.yahoo.com/_ylt=A0LEVw56_NVYklIA6wdXNyoA;_ylu=X3oDMTBybGY3bmpvBGNvbG8DYmYxBHBvcwMyBHZ0aWQDBHNlYwNzcg--/RV=2/RE=1490447610/RO=10/RU=http%3a%2f%2fresearchspace.ukzn.ac.za%2fbitstream%2fhandle%2f10413%2f9707%2fKiplimo_Joyce_Jepkorir_2012.pdf%3bsequence%3d1/RK=0/RS=vUjfDhOQDY57aKNmCQGBZiZ2ecg-; https://www.ncbi.nlm.nih.gov/pmc/articles/PMC4655238/pdf/fphar-06-00274.pdf; 10.1021/acs.jnatprod.8b01086; 10.1055/s-0029-1240611; 10.1055/a-0953-6007; 10.1080/14786419.2014.981188; 10.1016/j.arabjc.2014.11.045; https://www.researchgate.net/publication/237078139	antioxidant; antimicrobial
Mol_00268	P-cymene	Cc1ccc(cc1)C(C)C	7463	Terpenoid; Terpenoid	Monoterpenoid; Monoterpene	Schinus molle; Artemisia herba-alba; Artemisia herba; Foeniculum vulgare; Cupressus dupreziana; Cupressus sempervirens; Cupressus dupreziana; Cupressus arizonica; Chrysanthemum viscidehirtum; Commiphora quadricincta; Boswellia neglecta; Boswellia species; Tarchonanthus camphoratus; Plectranthus marrubioides; Tetradenia riparia; Morella salicifolia; Croton zambesicus; Cymbopogon schoenanthus; Cyperus rotundus; Thymus broussonetti; Thymus maroccanus; Teucrium polium subsp. polium; Teucrium leucocladum	Chemical composition, insecticidal and insect repellent activity of Schinus molle L. leaf and fruit essential oils against Trogoderma granarium and Tribolium castaneum.; Essential oil from Artemisia herba-alba Asso grown wild in Algeria: variability assessment and comparison with an updated literature survey.; Compositions and antifungal activities of essential oils of some Algerian aromatic plants.; Chemical composition and larvicidal activity of Algerian Foeniculum vulgare seed essential oil; Volatile constituents of the leaves of Cupressus duprezzana and Cupressus semper virens; Volatile constituents of the leaves of Cupressus duprezzana and Cupressus semper virens; Volatile constituents of Cupressus dupreziana and the sesquiterpenes of Cupressus sempervirens; Chemical composition and antimicrobial activity of essential oils of Cupressus arizonica Greene; Antibacterial and molluscicidal activities of the essential oil of Chrysanthemum viscidehirtum; Seasonal variation in the essential oil composition of Commiphora quadricincta and its effect on the maturation of immature adults of the desert locust, Schistocerca gregaria; Triterpenes from the resin of Boswellia neglecta; Phytochemical investigation of the resins of Boswellia species collected from Kebtele area in Agew-Awi (Gojjam); Repellency of essential oils of some Kenyan plants against Anopheles gambiae; Repellency of essential oils of some Kenyan plants against Anopheles gambiae; Repellency of essential oils of some Kenyan plants against Anopheles gambiae; Phytochemical investigation and evaluation of antimirobial activities of stem bark of Morella salicifolia; Chemical composition, antiproliferative, antioxidant and antibacterial activities of essential oils from aromatic plants growing in Sudan; Chemical composition, antiproliferative, antioxidant and antibacterial activities of essential oils from aromatic plants growing in Sudan; Chemical composition, antiproliferative, antioxidant and antibacterial activities of essential oils from aromatic plants growing in Sudan; Antimicrobial and insecticidal activities of the Endemic Thymus broussonetti Boiss. and Thymus maroccanus Ball.; Antimicrobial and insecticidal activities of the Endemic Thymus broussonetti Boiss. and Thymus maroccanus Ball.; Chemical and genetic diversity of two Mediterranean subspecies of Teucrium polium L.; Chemical analysis and biological activities of the essential oil of Teucrium leucocladum Boiss. (Lamiaceae)	19241279; 18164558; 11449503; 11830156; 11830156; 12736444; 15474566; 15474566; 15474566; 27569885; 27569885; 27569885; 22906882	10.1080/14786410802346223; 10.1016/j.arabjc.2012.04.042; 10.1016/j.fitote.2007.11.004; 10.1016/j.arabjc.2010.11.006; 10.1016/0031-9422(83)85029-8; 10.1016/0031-9422(83)85029-8; 10.1016/0031-9422(81)80025-8; 10.1016/j.bse.2007.05.009; 10.1016/S0367-326X(00)00154-4; 10.1016/S0031-9422(96)00559-6; http://www.ajol.info/index.php/bcse/article/view/20952; http://etd.aau.edu.et/handle/123456789/672; 10.1016/j.phytochem.2004.08.035; 10.1016/j.phytochem.2004.08.035; 10.1016/j.phytochem.2004.08.035; 10.4314/bcse.v33i2.10; 10.1016/j.apjtm.2016.06.009; 10.1016/j.apjtm.2016.06.009; 10.1016/j.apjtm.2016.06.009; 10.3923/JM.2017.218.228; 10.3923/JM.2017.218.228; 10.1016/j.phytochem.2012.05.019; 10.1016/j.bse.2003.12.009	insect repellent; antibacterial; molluscicidal
Mol_05855	Pachypodol	COc1cc(O)c2c(c1)oc(c(c2=O)OC)c1ccc(c(c1)OC)O	5281677	Flavonoid	Flavonoid aglycone	Jasonia montana; Senecio roseiflorus; Turraeanthus africanus	Flavonoids aglycones from Jasonia montana; Antiplasmodial activity of compounds from the surface exudates of Senecio roseiflorus; Isolation and characterization of six labdane diterpenes and one pregnane steroid of Turraeanthus africanus.	23513721; 24735827	10.1016/0031-9422(89)80084-6; http://europepmc.org/abstract/med/23513721; 10.1016/j.phytochem.2014.03.022	anti-plasmodial
Mol_09131	Parvinaphthol a	COC(=O)c1cc(OC)c2c(c1O)c(O)c(c(c2)OC)O	132524250	Naphthalene derivative		Pentas parvifolia	Naphthalene derivatives from the roots of Pentas parvifolia and Pentas bussei	27518587	10.1021/acs.jnatprod.6b00178	
Mol_09132	Parvinaphthol b	COC(=O)c1cc(OC)c2c(c1O)ccc(c2O)O	132524251	Naphthalene derivative		Pentas parvifolia	Naphthalene derivatives from the roots of Pentas parvifolia and Pentas bussei	27518587	10.1021/acs.jnatprod.6b00178	cytotoxic
Mol_09133	Parvinaphthol c	CO[C@@H]1O[C@H]2c3c(ccc4c3c(OC)cc(c4O)C(=O)O)O[C@@]3([C@H]2[C@H]([C@H]1C)CC3)C	132524252	Naphthalene derivative	Polycyclic naphthalene	Pentas parvifolia	Naphthalene derivatives from the roots of Pentas parvifolia and Pentas bussei	27518587	10.1021/acs.jnatprod.6b00178	cytotoxic
Mol_01524	Pellitorine	CCCCC/C=C/C=C/C(=O)NCC(C)C	5318516	Alkaloid	Amide	Artemisia dracunculus; Matricaria pubescens; Zanthoxylum usambarense; Zanthoxylum usambarense; Zanthoxylum gilletii	Alkamides from Artemisia dracunculus.; On the pungent principle of Matricaria pubescens; Chemical constituents and biological activities of Zanthoxylum usambarense; Study of biological active principles from Kenyan medicinal plants; Antimalarial compounds containing an alpha,beta-unsaturated carbonyl moiety from Tanzanian medicinal plants.	11730872; 11807969; 2236290	10.1016/S0031-9422(01)00347-8; 10.1016/S0031-9422(00)82632-1; 10.1002/ptr.849/full; http://lib.ugent.be/fulltxt/RUG01/000/695/119/RUG01-000695119_2010_0001_AC.pdf; 10.1055/s-2006-960985	insecticidal; fungicidal; antifungal; antimalarial
Mol_08030	Penduliflaworosin	COC(=O)[C@]1(C)CCCC2=C1CC[C@H]([C@@]12C[C@H](OC1=O)c1cocc1)C	71457894	Terpenoid	Diterpenoid	Croton sylvaticus	Diterpenoid derivatives of Kenyan Croton sylvaticus.	25973474	https://www.researchgate.net/publication/275039505_Diterpenoid_Derivatives_of_Kenyan_Croton_sylvaticus	
